{
  "schemaVersion": 1,
  "id": "qwen-code",
  "displayName": "Qwen Code",
  "command": { "program": "qwen", "args": ["--experimental-acp"] },
  "version": {
    "args": ["--version"],
    "pattern": "qwen(?:-code)? v?(\\d+\\.\\d+\\.\\d+)",
    "verified": { "minimum": "0.1.0", "ceiling": "0.2.0" }
  },
  "environment": ["DASHSCOPE_API_KEY", "HTTPS_PROXY"],
  "authHint": "Run `qwen` in a terminal and sign in, then check again.",
  "docsUrl": "https://github.com/QwenLM/qwen-code",
  "capabilities": { "loadSession": false, "mcpHttp": false }
}
